salary,company,place,description,title
[],[u'Group Voyagers'],"[u'12 reviews', u'Littleton, CO']","[u'ROLE: E-Learning Curriculum Designer', u'\n', u'DEPARTMENT: Human Resources', u'\n', u'REPORTS TO: Human Resources Director', u'\n', u'STATUS: Exempt', u'\n', u'JOB GRADE: EX 30', u'\n', u'WORKERS COMP CODE: 8810', u'\n', u'THE COMPANY', u'\n', u'At Globus family of brands, guests, partners, and associates are valued members of our family. Together we are in pursuit of our mission and vision and guided by our core values.', u'\n', u'Our Mission: We create happy guests.', u'\n', u'Our Vision: GFOB is family. We are genuine, loyal, and trusted. We are passionate about making guests happy and partners successful. We are open and welcoming. We make hard things easier. We are guided by our values. We do what\u2019s right. We care. It\u2019s what families do.', u'\n', u'Our Values:', u'\n', u' Passion- We are passionate about the Globus family of brands, our values, and making guests happy.', u'\n', u' Accountability-We can be counted on to do our best, follow through, learn from mistakes, and deliver results.', u'\n', u' Courage-We face challenges, surface issues, share our ideas, and do what\u2019s right.', u'\n', u' Collaboration-We work together, support each other, and involve others in decision making.', u'\n', u' Integrity-We are straightforward, honest, and open with our guests, partners, and each other.', u'\n', u' Service- We are proactive, anticipate the needs of others, and are always ready to listen.', u'\n', u'THE DEPARTMENT', u'\n', u'The Human Resources team strives to create a work environment where associates are enthusiastic about their jobs. HR is responsible for the implementation and execution of human resource functions and programs including compensation, performance management, succession planning, employee relations, benefit administration, employment regulations and compliance, recruiting, analysis and delivery of benefits, reception, and facilities maintenance.', u'\n', u'THE POSITION\n', u'Reviewing LMS technology, making recommendations for LMS and Implementing LMS', u'\n', u'Designing, building, and maintaining web-based, multi-media eLearning modules using authoring tools', u'\n', u'Publishing and delivering eLearning modules', u'\n', u'Integrating emerging instructional design methods and technologies into eLearning modules', u'\n', u'Working with subject matter experts/stakeholders and other personnel in identifying and developing course content and learning needs within required timeframes.', u'\n', u'Performing needs assessment and analysis to determine organizational needs and recommends training methods accordingly.', u'\n', u'Designing and implementing evaluation strategies for measuring the success of training programs.', u'\n', u'Tracking employee performance and measures training outcomes.', u'\n', u'Maintaining communication with training stakeholders and building collaborative partnerships with internal customers.', u'\n', u'Responding to and resolving LMS end user issues related to training.', u'\n', u'Maintaining records related to training.', u'\n', u'Developing and delivering instructor led (live on line) courses as needed including workshops related to LMS capabilities for a variety of audiences.', u'\n', u'Conducting periodic review of existing courses to ensure content is relevant and accurate.', u'\n', u'Managing eLearning development projects', u'\n', u'Creating multimedia products using a variety of software programs, primarily in Microsoft PowerPoint, Microsoft Word, Adobe Creative Cloud', u'\n', u'Applying interaction design and interactive learning principles to instructional solutions for adult learners', u'\n', u'Selecting, modifying, and integrating existing instructional materials that employ multimedia and emerging technologies', u'\n', u'EDUCATION', u'\n', u'Bachelor\u2019s degree or equivalent experience required, with a focus in multimedia design, graphic design, instructional design, or related field in learning and development', u'\n', u'Masters in Instructional Design or 3-5 years\u2019 meaningful experience in eLearning Instructional Design (ID) preferred', u'\n', u'ATD E-learning Instructional Design Certificate preferred\n', u'EXPERIENCE REQUIRED', u'\n', u'Minimum 3 years\u2019 experience in the successful design and creation of corporate eLearning programs\n', u'Strong analytical and problem-solving skills', u'\n', u'Strong time management skills and ability to meet deadlines, acknowledging urgency when necessary', u'\n', u'Detail-oriented and excellent organizational skills', u'\n', u'Working knowledge of web technologies (HTML5, JavaScript, CSS) and E-learning development software and other authoring tools', u'\n', u'Understanding of adult learning theories and evaluation methods', u'\n', u'Working knowledge of learning and development trends and compliance requirements', u'\n', u'Ability to craft and maintain multiple courses at a time', u'\n', u'TECHNICAL EXPERIENCE REQUIRED:', u'\n', u'Microsoft Office Suite \u2013 Word, Excel, PowerPoint, Publisher, and Outlook', u'\n', u'Experience using an LMS is required', u'\n', u'High degree of proficiency with Adobe Creative Suite is required \u2013 Photoshop, Illustrator, Premier', u'\n', u'Knowledge of E Learning Software and ability to recommend and implement', u'\n', u'MANAGEMENT KEY COMPETENCIES REQUIRED', u'\n', u' Strategic Ability', u'\n', u'o Keeps abreast of important trends that impact the industry, business or organization (technological, competitive, social, economic, etc.)', u'\n', u'o Considers a broad range of internal and external priorities when making decisions or solving problems', u'\n', u'o Comprehends and utilizes knowledge of competitors\u2019 business when making strategic decisions', u'\n', u' Business Acumen', u'\n', u'o Exhibits awareness of business issues, processes and outcomes and their impact on the organization\u2019s and department\u2019s direction and goals', u'\n', u'o Remains informed about the industry and how changes might impact the organization', u'\n', u'o Understands the key functions of various departments and how they inter-relate; Utilizes appropriate channels and processes', u'\n', u'\xa7 Researches, investigates, analyzes and draws conclusions from facts and trends', u'\n', u' Management & Leadership', u'\n', u'o Provides clear directions and priorities; delegates tasks appropriately', u'\n', u'o Ensures adequate resources and support are available to achieve goals', u'\n', u'o Routinely provides feedback on performance and uses effective coaching and counseling techniques', u'\n', u'o Cultivates the strengths of associates, coaches towards achievement, and sets plans for improvement', u'\n', u'o Recognizes ability, mentors and provides developmental opportunities to associates for career growth', u'\n', u'o Creates an open, positive and productive work environment where associates have the opportunity to succeed', u'\n', u'o Understands how to separate and combine tasks into efficient and effective workflow', u'\n', u' Fiscal Responsibility', u'\n', u'o Develops annual budget for area of responsibility', u'\n', u'o Monitors performance to budget & participates in quarterly re-forecasting', u'\n', u'o Controls costs (i.e. schedule adherence for o/t; absorptions; personal travel expenses; supply ordering)', u'\n', u'o Is timely in all reporting required (expense reports, accounts payable, monthly variance reporting)', u'\n', u'KEY COMPETENCIES REQUIRED', u'\n', u'The preferred candidate possesses the following competencies:', u'\n', u' Service: We are proactive, anticipate the needs of others and are always ready to listen.', u'\n', u'Desires to help others and to meet their needs. This includes internal and external partners, offices, guests, and vendors', u'\n', u'Seeks win-win situations and presents options, especially in resolving conflicts', u'\n', u'Provides timely and helpful information to others', u'\n', u'Takes action on behalf of others to simplify their life/work/experience', u'\n', u'Responsive and attentive to the needs of others', u'\n', u' Passion: We are passionate about the Globus family of brands, our values, and making guests happy.', u'\n', u'o Strives to retain goodwill even when modifying or denying requests', u'\n', u'o Positive energy and enthusiastic when dealing with others', u'\n', u'o Takes pride in doing the right things', u'\n', u'o Treats guests, colleagues, and partners with respect', u'\n', u' Teamwork & Collaboration: We work together, support each other, and involve others in decision making.', u'\n', u'Builds and maintains effective working relationships with co-workers, partners, guests, and vendors to improve business processes and outcomes.', u'\n', u'Treats others with respect', u'\n', u'Contributes to achievement of team and departmental goals', u'\n', u'Provides back up and support to others as needed', u'\n', u'Fosters collaboration among team members, departments, companies, partners, etc.', u'\n', u'Relates to others in an open and accepting manner', u'\n', u'Recognizes a wide range of communications styles and personality types and responds appropriately', u'\n', u'Cultivates and maintains professional relationships', u'\n', u'Collaborates with internal partners', u'\n', u'Shares pertinent information to the benefit of others', u'\n', u' Results and Accountability: We can be counted on to do our best, follow through, learn from mistakes and deliver results.', u'\n', u'Works with the team and management to achieve individual, department, and corporate goals', u'\n', u'Meets critical deadlines within time frame outlined', u'\n', u'Demonstrates willingness, openness, persistence, and initiative to achieve desired results', u'\n', u'Probes to get to the heart of the problem and takes action to achieve results', u'\n', u'Focuses priorities and manages time effectively', u'\n', u'Takes ownership of work and assigned processes and projects', u'\n', u' Ethics and Integrity: We are straightforward, honest, and open with our guests, partners, and each other.', u'\n', u'o Conducts business in a way that instills trust, confidence and respect', u'\n', u'o Utilizes fair process without bias', u'\n', u'o Acts with discretion and good judgment while maintaining confidentiality', u'\n', u'o Exercises the highest standard of ethics in all decisions that impact guests, vendors, suppliers, and the organization', u'\n', u'o Takes ownership of work and assigned processes/projects', u'\n', u' Agility, Adaptability, and Flexibility through Courage: We face challenges, surface issues, share our ideas, and do what is right.', u'\n', u'o Demonstrates resilience in the face of constraints, frustrations, or adversity', u'\n', u'o Displays willingness and flexibility in handling multiple demands, changing priorities, and ongoing organizational needs', u'\n', u'o Quickly and effectively evaluates and appropriately adjusts to a change in direction or situation', u'\n', u'o Accepts change as a necessary and normal part of organizational growth', u'\n', u'o Open to adopting new approaches and behaviors', u'\n', u'o Handles day to day work challenges confidently', u'\n', u' Effective Communication', u'\n', u'o Professionally conveys information and ideas both orally and in writing.', u'\n', u'o Maintains positive and professional verbal and nonverbal communication with all', u'\n', u'o Shares information appropriately and is receptive to feedback and expression of ideas', u'\n', u'o Perceives the needs of various audiences and can adjust communications appropriately', u'\n', u'o Listens and responds appropriately to others.', u'\n', u'\n', u'EOE', u'\n', u'While performing this job, it will require: Eight (8) hours or more a day of sitting; walking; standing; bending; answering the telephone; entering data into the computer; retrieving data from the computer or analyzing data from reports.']",E-Learning Curriculum Designer
[],[u'CoreAxis'],[u'United States'],"[u'Contract to permanent', u'\nThe Learning and Development Coordinator is responsible for the planning, coordination, implementation and evaluation of innovative and contemporary learning and development programs that supports strategies to build a sustainable, resilient, and adaptable workforce.', u'\n', u'\n', u'Key Responsibilities:', u'\n', u'\n', u'Review and revitalize all existing learning and development activities considering new modes of delivery for remote workers, residential, professional, administrative staff and volunteers.', u'\nCo-ordinate and maintain the organizations orientation program for new staff and volunteers that includes service and position specific checklists, self directed learning packages, buddying and mentoring, corporate orientation and customer care programs.', u'\nCoordinate and maintain the organizational learning and development calendars and associated awareness months, considering mechanisms to promote the various activities and maximize participation from staff and volunteers across the company\u2019s geographic footprint.', u'\nOversee the planning, delivery and evaluation of mandatory training programs to ensure skilled staff and volunteers and compliancy with quality standards and audit requirements. This includes the preparation of reports on staff attendance and follow up actions.', u'\nBuild a register and maintain relationships with a range of reputable training providers in the areas of leadership, management, clinical, care and other key organizational learning and development priorities.', u'\nCoordinate requests to attend external courses and conferences which involves follow up on approvals, registrations and the associated travel and accommodation requirements.', u'\nOversee the coordination of internal learning and development activities, including: workshops, toolbox talks and staff meeting training sessions which may include the sourcing of contemporary trainers, guest speakers, specialist providers, educational consultants as requested by Service Managers. This may include assisting with organizing venues, RSVP\u2019s, catering, training materials and equipment.', u'\nCoordinate and manage traineeships in conjunction with managers, trainees and service providers, including monitoring key deadlines, reimbursements and funding incentives, coordinating supervision and training activities, sourcing government funding and initiatives and actively feeding into the curriculum development where possible.', u'\nEnsure learning and development records and statistics are maintained and reported to effectively monitor, manage and plan organizational learning and development activities.', u'\nEvaluate internally and externally facilitated learning and development activities, workshops and conferences and report on the return on investment in terms of costs, learning\u2019s gained, strategies to reinforce learning and share knowledge with the organization as appropriate.', u'\nIdentify opportunities for funding which can be utilized to provide enhanced programs and opportunities for professional development and expand staff qualifications, knowledge and skill base including assisting with application preparation and submission.', u'\nAssist Managers with design and delivery of training and e-learning packages providing templates for lesson plans, presentation formats, facilitator guide formats, participant guides and evaluation documentation.', u'\nActively participate in special projects, initiatives or programs as required.']",Learning Coordinator
[],[u'Elevations Credit Union'],"[u'24 reviews', u'Broomfield, CO 80021']","[u'When joining Elevations, you can expect to work for a company that:\n', u'Provides amazing experiences and creates raving fans.\n', u'Strives to provide solutions for a better life and promises employees it will be the best place they have ever worked.\n', u'Wins awards such as \u201cBest Bank\u201d, \u201cBest Companies to Work for in Colorado\u201d and even the \u201cMalcolm Baldrige National Quality Award\u201d, the only Presidential award for quality.\n', u'Has a highly-engaged workforce and emphasizes career growth, empowerment and servant leadership.', u'\n', u'What\u2019s in it for you ', u':\n', u'Competitive pay, incentive programs, 401k matching, mortgage and auto discounts\n', u'4 weeks min. paid time off, work anniversary paid time off, 11 paid holidays, and 16hrs paid volunteer time off\n', u'Medical, dental, and vision health plans with FSA or HSA options\n', u'Onsite fitness center, yoga classes, wellness committee events (hiking, softball, soccer,.. to name a few!), health fairs with biometrics screening and flu shots\n', u'Onsite cafe\n', u'Employee Assistance Program with a variety of services\n', u'Career development, trainings, career coaching, job shadowing, mentoring program, tuition reimbursement up to $5,000/year, and a recognition system\n', u'Culture of excellence and continuous improvement\n', u'We strive to be the best place you\u2019ve ever worked!', u'\n', u'The ', u'e-Learning Instructional Designer/Developer ', u'is an Instructional Designer with a strong learning technology and multimedia skillset. We\u2019re looking for an innovative individual who can design and build memorable, engaging learning experiences for our users. This could include e-Learning, videos, animated modules, simulations, interactive tutorials, and other learning assets. This person must be motivated by innovation and creativity and is an expert is communicating learning concepts visually.', u'\n', u'Essential Functions include:\n', u'Researches and organizes information to compile instructional material (eLearning courses, video tutorials, instructor guides, reference material, audio and video scripts, storyboards, and assessment questions) utilizing appropriate learning and development methodologies and/or instructional design tools for curriculum and course development.\n', u'Work closely with stakeholders to identify instructional goals and objectives and offer analysis, design, and development options for achieving best outcomes with the intended subject matter. When appropriate, draft storyboards and prototypes with the stakeholder for new online learning activities.\n', u'Collaborate on the adoption of appropriate instructional technologies that can help advance training. Stay up-to-date on new delivery strategies and training options and include facets of social and peer learning, game-based learning, informal learning, etc. as needed\n', u'Apply best practices in adult learning to design, write, and build a range of high-quality learning experiences, with an emphasis on e-learning, video, animations, games, etc.\n', u'Exercise superior project management and workflow coordination skills. Should be able to partner with senior business stakeholders to keep project timelines in check.\n', u'Should be strong at defining learning objectives, scenarios, building simulations, audio scripts, progress checks, performance evaluations and knowledge assessments.\n', u'Utilizes ADDIE, SAM, Kirkpatrick and other recognized models to design, develop and publish engaging course content, learning activities and knowledge assessments for ILT, online, virtual and blended modalities.\n', u'Maintain currency in current learning content, sciences and instructional design principles for effective support of delivery at all times.\n', u'Ability to design assessments to support defined learning objectives and creates metrics to evaluate effectiveness of training courses.\n', u'Collaborate with the LMS team to upload, test and maintain content within a Learning Management System.\n', u'Ability to handle a multi-project workload, which may shift with prioritization.\n', u'Reports to:\n', u'E-Learning Instructional Design Manager', u'\n', u'Manages:\n', u'This role does not have supervisory responsibility', u'\n', u'Required Competencies:\n', u'Building Partnerships, Decision Making, Planning and Organizing, Monitoring Information, Innovation, Technology Savvy, Continuous Learning', u'\n', u'Required Education and Experience:\n', u'Bachelor\u2019s degree or knowledge consistent with a degree in Instructional Design, Adult Education or related field (i.e. CPLP, or E-Learning Certificate)\n', u'3+ years of experience designing web-based training or e-learning. Must be prepared to recent work examples, and/or have a portfolio of previous body of work.\n', u'Intermediate knowledge of and working experience with Adobe Captivate\n', u'Knowledge of ADDIE and SAM.\n', u'Knowledge/Experience with learning management systems\n', u'Proven planning and organizational skills with the ability to manage multiple and diverse projects simultaneously.\n', u'Demonstrated problem-solving ability and consistent, logical and effective decision-making\n', u'\n', u'Preferred Education and Experience:\n', u'Knowledge of financial operations or experience in a financial institution preferred\n', u'\n', u'Work Environment:\n', u'This job operates in an office setting and routinely uses standard office equipment', u'\n', u'Physical Requirements:\n', u'Sitting frequently, walking occasionally, use of hands frequently, hearing constantly, talking frequently, exerting up to 10 lbs. of force occasionally to lift, carry, push, pull, or move objects.', u'\n', u'Position Type/Expected Hours of Work:\n', u'Full time / 40 hours per week', u'\n', u'Classification:\n', u'Exempt', u'\n', u'Location:\n', u'Elevations Support Center', u'\n', u'Other Duties:\n', u'Please note this job description is not designed to cover or contain a comprehensive listing of activities, duties or responsibilities that are required of the employee for this job. Duties, responsibilities and activities may change at any time with or without notice.', u'\n', u'About Us ', u': ', u'Elevations Credit Union is a member-owned not-for-profit financial institution serving Colorado\u2019s Front Range. Founded in 1953, we\u2019ve grown from 12 members and less than $100 in assets to an institution with 13 branches and more than 120,000 members that manages over $2 billion in assets and is the No. 1 credit union mortgage lender in Colorado. At Elevations, we\u2019ve made a commitment to move away from a product-centered business model and focus instead on creating consumer solutions. Our objective is to provide our members, as well as the entire community, with unbiased consumer information.', u'\n', u'EEO Statement: ', u'Elevations Credit Union is an equal opportunity employer. We do not discriminate on the basis of race, color, religion, marital status, age, national origin, ancestry, physical or mental disability, medical condition, pregnancy, genetic information, gender, sexual orientation, gender identity or expression, veteran status, or any other status protected under federal, state, or local law. All aspects of employment including the decision to hire, promote, discipline, or discharge, will be based on merit, competence, performance, and business needs.', u'\n', u""Candidates for certain positions may be required to submit to a credit history report in determining qualification for employment with Elevations Credit Union. If the position you are applying for requires a credit history report, any information received in such a report will not be the sole factor in making an employment decision. A history of personal financial irresponsibility may be reason for disqualification insofar as it relates to your potential job duties. Elevations Credit Union is aware that occasionally there are extenuating circumstances that may affect an individual's credit history. We comply with the Fair Credit Reporting Act and the Colorado Employment Opportunity Act.""]",E-Learning Instructional Designer/Developer
