salary,company,place,description,title
[],[u'Ocean County College'],"[u'57 reviews', u'Toms River, NJ 08753']","[u'Adjunct Faculty, e-Learning provide online course instruction in a manner that ensures student comprehension, retention of knowledge and positive and effective student engagement. This position demonstrates an understanding of course content; appropriate methods for delivering content via current e-learning technology; and evidence of pedagogical and technological acumen that includes robust instruction and communication practices.', u'\n', u'\n', u'List of Essential Activities', u'\n', u'1. Manages and facilitates class activities and adheres to and meets all established college policies\n', u'\n2. Adheres to Ocean County College guidelines and standards for online and online/hybrid learning', u'\n3. May attend departmental meetings; and serve on search committees as determined by the School Dean, Dean of eLearning and/or Vice President at their discretion', u'\n4. Responds to invitations to make recommendations to the School Dean and Dean of e-Learning regarding the selection of textbooks or other required texts relative to the adjunct faculty member\u2019s appropriate academic discipline and teaching assignment', u'\n5. Submits final grades no later than 48 hours after the conclusion of their last day of class; remains available to students during the week following the posting of final grades as mutually determined by the School Dean, Dean of e-Learning and/or Vice President and the adjunct faculty member', u'\n6. Participates in student learning outcomes assessment related to the adjunct\u2019s teaching assignment as directed by the School Dean, Dean of e-Learning and/or Vice President at their discretion\n', u'\n7. Adheres to all established College absence and attendance policies, guidelines and requirements which includes the Adjunct Handbook', u'\n8. Completes related projects and duties as assigned', u'\n', u'\n', u'Required Qualifications', u'\n', u'1. Education \u2013 one of the following:', u'\na. Master\u2019s Degree in the discipline;', u'\nb. Master\u2019s Degree in a different discipline with at least 18 graduate credits in the discipline;', u'\nc. Master\u2019s Degree in a different discipline, plus at least two years of directly related professional field experience and/or certification/licensure in the field of specialization', u'\n2. Prior experience teaching at the high school or college level; or experience as a trainer or in conducting group presentations', u'\n3. Proven communication and interpersonal skills.', u'\n4. Recent technology experience as required of the position.', u'\n', u'\n', u'Preferred Qualifications', u'\n', u'1. Doctorate Degree', u'\n2. One year of experience using Learning Management Systems', u'\n3. Two years distance learning teaching experience', u'\n', u'\n', u'ADA Selection', u' ', u'Sedentary', u'\n', u'\n', u'ADA Selection Definitions', u' ', u'ADA Selection Definitions', u'\n', u'\n', u'Hours', u' ', u'Other', u'\n', u'\n', u'If other, please specify', u'\n', u'Vary depending on course assignment', u'\n', u'\n', u'Work Days', u'\n', u'\n', u'Duration Type', u' ', u'Semester to Semester basis', u'\n', u'\n', u'Duration of Employment', u'\n', u'Based on college needs', u'\n', u'\n', u'Salary', u' ', u'$825/sh']","Adjunct Assistant Professor, e-Learning"
[],[u'CoreAxis'],[u'United States'],"[u'Contract to permanent', u'\nThe Learning and Development Coordinator is responsible for the planning, coordination, implementation and evaluation of innovative and contemporary learning and development programs that supports strategies to build a sustainable, resilient, and adaptable workforce.', u'\n', u'\n', u'Key Responsibilities:', u'\n', u'\n', u'Review and revitalize all existing learning and development activities considering new modes of delivery for remote workers, residential, professional, administrative staff and volunteers.', u'\nCo-ordinate and maintain the organizations orientation program for new staff and volunteers that includes service and position specific checklists, self directed learning packages, buddying and mentoring, corporate orientation and customer care programs.', u'\nCoordinate and maintain the organizational learning and development calendars and associated awareness months, considering mechanisms to promote the various activities and maximize participation from staff and volunteers across the company\u2019s geographic footprint.', u'\nOversee the planning, delivery and evaluation of mandatory training programs to ensure skilled staff and volunteers and compliancy with quality standards and audit requirements. This includes the preparation of reports on staff attendance and follow up actions.', u'\nBuild a register and maintain relationships with a range of reputable training providers in the areas of leadership, management, clinical, care and other key organizational learning and development priorities.', u'\nCoordinate requests to attend external courses and conferences which involves follow up on approvals, registrations and the associated travel and accommodation requirements.', u'\nOversee the coordination of internal learning and development activities, including: workshops, toolbox talks and staff meeting training sessions which may include the sourcing of contemporary trainers, guest speakers, specialist providers, educational consultants as requested by Service Managers. This may include assisting with organizing venues, RSVP\u2019s, catering, training materials and equipment.', u'\nCoordinate and manage traineeships in conjunction with managers, trainees and service providers, including monitoring key deadlines, reimbursements and funding incentives, coordinating supervision and training activities, sourcing government funding and initiatives and actively feeding into the curriculum development where possible.', u'\nEnsure learning and development records and statistics are maintained and reported to effectively monitor, manage and plan organizational learning and development activities.', u'\nEvaluate internally and externally facilitated learning and development activities, workshops and conferences and report on the return on investment in terms of costs, learning\u2019s gained, strategies to reinforce learning and share knowledge with the organization as appropriate.', u'\nIdentify opportunities for funding which can be utilized to provide enhanced programs and opportunities for professional development and expand staff qualifications, knowledge and skill base including assisting with application preparation and submission.', u'\nAssist Managers with design and delivery of training and e-learning packages providing templates for lesson plans, presentation formats, facilitator guide formats, participant guides and evaluation documentation.', u'\nActively participate in special projects, initiatives or programs as required.']",Learning Coordinator
[],[u'Orchard Hill College and Academy Trust'],"[u'House, NM']","[u'Person Specification\n', u'The person specification shows the abilities and skills you will need to carry out the\n', u'duties in the job description. Short listing is carried out on the basis of how well you\n', u'meet the requirements of the person specification. You should mention any\n', u'experience you have had which shows how you could meet these requirements\n', u'when you fill in your application form. Priority 1 criteria are essential on appointment.\n', u'Priority 2 criteria may be acquired after appointment. If you are selected for interview\n', u'you may be asked also to undertake practical tests to cover the skills and abilities\n', u'shown below:', u'\n', u'Qualifications/Experience Priority', u'\n', u'\n', u'Experience of working within a team 1', u'\n', u'Experience of working, caring or voluntary work with people who have\n', u'\ndisabilities 1', u'\n', u'Experience of working in an education environment', u'\n2', u'\n', u'\n', u'Ability, Skills and Knowledge', u'\n', u'\n', u'Able to demonstrate a commitment to the safeguarding of children and', u'\nvulnerable adults 1', u'\n', u'Able to maintain accurate legible and up to date records of individual', u'\nstudent achievements, using a variety of formats including ICT 1', u'\n', u'Able to contribute to the planning and implementation of sessions by', u'\nproviding feedback on previous sessions, initiating own suggestions,', u'\ncreating resources, interpreting and putting into practice session plans, 1\n', u'guidelines and procedures', u'\n', u'Able to communicate (receive and transmit) with students and staff using a', u'\nvariety of media, spoken, sign, written, gestural and intuitive 1', u'\n', u'Able to take responsibility for individual and small groups of students, who', u'\nmay communicate using challenging behaviour, at college and out in the', u'\ncommunity, which will involve physically supporting students as they walk, 1', u'\npushing students in wheelchairs, personal and intimate care and coping', u'\nwith emergencies', u'\n', u'Able to recognise the students as adults and individuals in their own\n', u'\nright and to reflect this during all interactions with the students and choice 1', u'\nof activities', u'\n', u'Able to promote and adhere to the Council\u2019s Equality and Diversity Policy,', u'\nSafeguarding of Children and Vulnerable Adults Policies and Health and 1', u'\nSafety Policies', u'\n', u'Demonstrable practical skills or previous work experience in any of the', u'\n2\n', u'following areas: Horticulture, Catering and E-Learning']",Learning Support Assistant
"[u'$130,253 - $173,670 a year']",[u'Ocean County College'],"[u'57 reviews', u'Toms River, NJ 08753']","[u'The Vice President of e-Learning and Learning Enterprises serves as the strategic and operational leader for the planning, development, and successful implementation of e-Learning programs of instruction and related learning support services for local, national, and international opportunities.', u'\n', u'\nThe Vice President provides vision and drives change in areas where e-Learning has the opportunity for the College to realize growth in student enrollment and partnerships.', u'\n', u'\nThe Vice President must have the ability to establish and maintain strong and collegial relations through mutual trust and respect with students, faculty, lecturers, administrators, staff, and partnership constituents within e-Learning and Learning Enterprises throughout the College and among institutional partnership stakeholders. Additionally, the Vice President must have the ability to lead, inspire, promote innovation, and advance the College\u2019s commitment to student success.', u'\n', u'\nThis position reports directly to the President of the College; serves as a member of the President\u2019s Leadership Team; interacts with the Bylaw, Policy, and Curriculum Committee and International Programs Committee of the Board of Trustees; and works with colleagues across the state, country, and world.', u'\n', u'\n', u'List of Essential Activities', u'\n', u'1. Provides strategic leadership and supervision for all programs and activities within e-Learning and Learning Enterprises, focusing on an agile approach to creating, implementing, and marketing new business and partnership opportunities locally, nationally, and internationally.', u'\n2. Leads strategic planning and formulates the e-Learning/Learning Enterprises budget to ensure initiatives are properly funded and produce expected cost-to-benefit ratios.', u'\n3. Provides primary leadership for e-Learning/Learning Enterprises related to program approvals, re-accreditation processes, program service contracts, and agreements with university and industry partners.', u'\n4. Continuously evaluates staffing needs and recommends organizational changes to support ongoing and new programs. Oversees the selection, evaluation, and professional development of e-Learning/Learning Enterprises faculty and staff, both on campus and internationally.', u'\n5. Collaborates across the College and among partnerships to drive strategies, build and sustain relationships, and promote new business opportunities within an entrepreneurial framework.', u'\n6. Provides leadership for e-Learning and Learning Enterprise initiatives with other higher education institutions and appropriate business, industry, and university partners, domestically and internationally, and for ensuring e-Learning representation on appropriate and relevant governance and other College committees.', u'\n7. Stays up-to-date on the complex issues facing higher education and technologies utilized by e-Learning as well as ensures currency and compliance in e-Learning and Learning Enterprises initiatives, practices, and processes.', u'\n8. Plans, organizes, and directs international education programs. Works closely with the Executive Vice President of Finance and Administration to develop enrollment projections, revenue and expense projections, and other analyses as needed to make decisions related to implementing new programs and evaluating the ongoing performance of existing programs.', u'\n9. Works closely with the Vice President of Academic Affairs to ensure cooperative and collaborative development and implementation of courses, programs, and other pedagogical initiatives. Works closely with the Vice President of Student Affairs to ensure cooperation and collaboration in e-Learning recruitment, marketing, admissions, and retention of online students.', u'\n10. Maintains a visible, accessible presence, both internally and externally, and advances the institutional vision of Ocean County College.', u'\n', u'\n', u'Required Qualifications', u'\n', u'1. Doctoral degree or active enrollment in a doctoral degree program in a teaching discipline related to the responsibilities of the Vice President of e-Learning and Learning Enterprises position.', u'\n2. Ten years of progressively increasing levels of responsibility in academic administrative roles in higher education at the Dean/Director level or above, a minimum of five of which should include the planning, marketing, and implementation of e-Learning initiatives.', u'\n3. Demonstrated experience in project management, strategic planning, report writing, and the preparation of detailed written documents and oral communications requiring a high level of accuracy.', u'\n4. A depth of experience which illustrates the ability to lead a complex organization, including unique local, national, and international partnerships.', u'\n5. Three years of full-time college teaching experience or equivalent, to include experience in teaching through an e-Learning platform.', u'\n6. Experience leading a major element of a re-accreditation process.', u'\n7. Prior experience working with international constituents to further productive and profitable partnerships.', u'\n', u'\n', u'Preferred Qualifications', u'\n', u'1. Community college experience.', u'\n2. Prior experience managing faculty/staff in a unionized environment.', u'\n', u'\n', u'ADA Selection', u' ', u'Light', u'\n', u'\n', u'ADA Selection Definitions', u' ', u'ADA Selection Definitions', u'\n', u'\n', u'Hours', u' ', u'40 Hours', u'\n', u'\n', u'If other, please specify', u'\n', u'\n', u'Work Days', u' ', u'Mon - Fri', u'\n', u'\n', u'Duration Type', u' ', u'Annual - 12 months', u'\n', u'\n', u'Duration of Employment', u'\n', u'Executive-level administrators work with full acceptance of a professional obligation to commit to extra hours beyond 40 hours per week as the work of the position requires.', u'\n', u'\n', u'Salary', u' ', u'$130,253 - $173,670 depending on experience']",Vice President of e-Learning and Learning Enterprises
