salary,company,place,description,title
[],[u'American Institutes for Research'],"[u'180 reviews', u'United States']","[u'Overview\n', u'American Institutes for Research (AIR) is one of the largest behavioral and social science research organizations in the world. AIR\u2019s mission is to conduct and apply the best behavioral and social science research towards improving people\u2019s lives with a special emphasis on the disadvantaged. Much of this work informs the development and implementation of policies that require and produce significant quantities of diverse data.', u'\n', u""\nThis part-time E-Learning Developer position is within AIR's Technology Solutions (TS) group which provides high quality technical expertise and solutions by focusing on responsive service, flexibility in its solutions delivery, and implementations that enhance the value of AIR\u2019s work. TS partners with projects in the area of software technology integration, learning technologies, and data analytics to make AIR a leader in evidence-based solutions, driven by technology.\n"", u'Responsibilities\n', u'The primary purpose of this position is to provide e-learning development and support (e.g. self-paced modules) for various on-line training needs for projects. Secondarily, this position will also support instructional design needs.\n', u'Qualifications\n', u""Minimum of a bachelor's degree in education, distance education, instructional technology, or a related field with 3 years of experience."", u'Experience developing distance learning products using Articulate Storyline 360 and Storyline version 2 & 3.', u'Experience working with subject matter experts to create engaging interactive training.', u'Knowledge of applied instructional design methods to the creation of learning products for an adult audience.', u'Familiarity with the uploading and set-up of distance learning products in the Moodle Learning Management System.', u'Excellent attention to detail and quality.', u'Customer-focused approach to work.', u'Ability to work on multiple projects with competing demands simultaneously.', u'Must be able to communicate effectively with clients, subject matter experts, and other team members both verbally and in writing.', u'Must be able to work closely and collaboratively with staff.', u'Must have a client-driven approach.', u'Ability to work as a part of team to accomplish objectives.', u'Ability to plan and organize within tight schedules and deadlines.', u'Must demonstrate initiative in moving tasks forward to achieve desired results.', u'Continually consults and seeks the input of others.', u'\n', u'LI-AS1']",E-Learning Developer (Part-Time)
[],[u'ACE Hardware'],"[u'3,935 reviews', u'United States']","[u'The Job\n', u'The ', u'Learning Consultant ', u'will facilitate classroom, in-store and virtual training to Retailers, Store Managers, and their teams in the Eastern Division of the United States. This position will be the Leadership Development expert and be certified to teach and market all of the Ace Management Development workshops to drive overall store performance in each region. The Learning Consultant assesses regional retailer needs, develops strategies, and influences Retailers to invest and participate in Ace\u2019s management development workshops. This is a remote position with 80-90% travel. This person should reside in Chicagoland or another major city in the Eastern Division, near a major airport.\n', u'What you\u2019ll do\n', u'Sets up Workshop Calendar \u2013 ', u'Works with Team of Region Managers and District Managers to fill calendar of workshops for each region, to include budget and logistics needs. Ability to assess regional needs, develop strategies, and translate and customize plans into executable action.\n', u'Facilitates Learning \u2013 ', u""Facilitates advanced management development and operations workshops to Ace store owners, managers and associates via classroom learning and blended virtual training methods to drive retailer business results. Conducts training that motivates, builds competencies, and improves individual's performance and contributions to their store results.\n"", u'Markets Workshops ', u'\u2013 Markets and Communicates all upcoming workshops to ensure workshops are being utilized by retailers and attendee levels are maximized.\n', u'Subject Matter Expert on Training \u2013 ', u'Provides input and serves as a subject matter expert on training standards, content, and practices to help the Retail Training Curriculum Design team better understand the Field\u2019s learning needs and ensures all workshops are relevant and are up to date. May update some content as needed.\n', u'Reports Training Effectiveness ', u'\u2013 Provides regular feedback on the training being conducted in the field along with insights and feedback regarding the successes and opportunities to drive continuous improvement.\n', u'Serves as an operations expert \u2013 ', u'Expert and consultant on Ace\u2019s standards, management tools, and training systems to maximize operational excellence. Stays current on operational standards, procedures, and resources to enhance ability to provide leadership and maximize business results.\n', u'Builds Solid Relationships ', u'\u2013 Creates a partnership between Retail Ops, Retailers, Store Managers, and Training Consultants, that stimulates transfer of training, return on training investment, and improves store results. Coaches people on how to measure and improve training results, and how to appropriately diagnose problems and create actions/behaviors that solve them.\n', u'What you need to succeed\n', u'Ability to travel 80-90% of the time across the Eastern United States (35-40 weeks of travel per year) - We are looking for a Road Warrior\n', u'B.A / B.S in Business, Education, Communications, or related field\n', u'4-7 years Retail Operations Training Delivery and Consulting\n', u'Ability to work remotely with various corporate departments\n', u'A working knowledge of operational aspects of a retail store, preferably through direct experience\n', u'Strong facilitation/presentation skills. Ability to deliver training in a classroom, store, or online setting\n', u'Ability to consult, think outside the box, influence and coach adult learners\n', u'Proficiency in Microsoft Suite and E-learning development tools and software (Adobe Connect or Zoom)\n', u'Ability to develop and maintain positive business relationships and foster an environment of mutual respect, understanding, and support\n', u'Able to foster teamwork and collaboration. Can motivate others both internal and external to perform enthusiastically\n', u'Strong ability to convey clear, concise information in verbal, written, electronic, and other communication formats as well as attention to detail and follow-up; and can demonstrate active listening while engaging others\n', u'Ability to anticipate and respond to the needs of stakeholders (e.g., internal and external customers, etc.) in a timely manner\n', u'Ability to prioritize assignments and projects in an efficient and timely manner, strong organization and time management skills\n', u'Self-managing, self-motivating, open minded; comfortable working with an off-site manager\n', u'Skilled in negotiations and conflict resolution. Ability to recognize strengths and weaknesses and coach accordingly\n', u'Strong analytical and problem-solving skills\n', u'We want to hear from you!\n', u""\nWhen most people think of career opportunities with Ace Hardware, they often think of the helpful cashiers and sales associates at their local store. However, have you also considered the people behind the scenes who select, promote, ship and process the invoices for more than 75,000 products? Maybe you haven't, but we'd like you to. Because together we help our customers take care of their homes. Come find out why a career with the Ace Hardware Corporation is one of America's best kept secrets.\n"", u'Equal Opportunity Employer\n', u'\nAce Hardware Corporation and its subsidiaries are committed to a policy of promoting equal employment opportunities. The company recognizes the importance of diversity and leveraging the skills and talents of all people to the mutual advantage of each individual and the organization. The company is committed to the prevention of employment discrimination related to race, religion, color, sex (including sexual harassment), gender identity, national origin, age, marital status, disability and military discharge, or any other action covered by federal or state laws.']",Learning Consultant (Field Based)
[],[u'Uber'],"[u'694 reviews', u'San Francisco, CA 94103']","[u'At Uber, we ignite opportunity by setting the world in motion. We take on big problems to help drivers, riders, delivery partners, and eaters get moving in more than 600 cities around the world.', u'\n', u'\nWe welcome people from all backgrounds who seek the opportunity to help build a future where everyone and everything can move independently. If you have the curiosity, passion, and collaborative spirit, work with us, and let\u2019s move the world forward, together.', u'\n', u'About the Role', u'\n', u'\nUber is looking for Learning Experience Designers to work with our Global Community Operations team and own the design and development of scalable training products that stick. This multifaceted role requires project management, creativity and proficiency in adult learning, storytelling/writing, elearning and live learning development, user experience, and training.', u'\n', u'\nYou\u2019ll be supporting the Global Learning Experience (LX) team in the creation of clear, effective, engaging learning experiences. You\u2019ll work with a variety of Subject Matter Experts (SMEs) and utilize available resources to produce relevant, measurable and learner-centered learning solutions utilizing scripts, storyboards, content authoring tools, and design techniques.', u'\n', u'What You\u2019ll Do', u'\n', u'\nManage the end-to-end design and development of a learning solution, from initial scoping to final learning product release.', u'\nWork within an Agile learning team to provide feedback the elevates the quality of all training resource; quickly iterate as needed, optimizing the team workflow for effective yet efficient designs', u'\nWork with SMEs and internal clients to synthesize content, develop scripts, and produce digital and live learning experiences that support knowledge acquisition and application. This includes, but is not limited to, video animations, interactive interfaces, simulations, screencasts, infographics, and other digital or non-digital training resources.', u'\nDevelop performance-based learning objectives and ensure training products are designed and to achieve those objectives through effective design practices, testing, and other UX best practices.', u'\nUphold and elevate the quality and effectiveness of learning designs used by the team', u'\nCoach other designers in best practices, and help the team conceptualize, design, and organize projects.', u'\n', u""What You'll Need"", u'\n', u""\nA personal portfolio linked on the top of your resume. Please share a sample of elearnings or anything relevant you'd like to share pertaining to this role"", u'\nBachelor\u2019s degree and a minimum 3 years of instructional design experience', u'\nExperience with LMS environments, Adobe Creative Cloud, elearning content authoring tools (Adobe Captivate, Articulate Storyline, Elucidat, etc.), and screencasts (Screenflow or Camtasia)', u'\nKnowledge of different elearning formats and ability to recommend the best approach based on the uniqueness of each situation (.MP4, SCORM or xAPI)', u'\nBackground in adult learning and instructional design; additional familiarity with design thinking, UX, and/or video production preferred', u'\n', u'\nBonus Points if', u'\n', u'\nProficiency with HTML, CSS, Javascript', u'\nExperience in UX and visual/graphic design', u'\nExperience in customer support or community operations', u'\nExperience working on a global team', u'\n', u'\nAbout the Team', u'\n', u'\nOur Community Operations Teams are all about operational efficiency, and as a part of the learning team, you would be ensuring that the teams are able to continuously provide premier support to everyone involved in the Uber experience. This role is about designing scalable, engaging and effective learning experiences for our learning programs that will be rolled out to tens of thousands of people around the world']",Learning Designer / E-learning Developer
[],[u'IGS Energy'],"[u'132 reviews', u'Dublin, OH 43017']","[u'Learning Producer Summary: The Learning Producer is responsible for building workforce capability and engagement through learning. The role works directly with business partners and as part of a collaborative L&D team to develop learning solutions to address business effectiveness issues. The role aligns with the overarching talent development and HR goals. Responsibilities may include: Performance consulting with internal business partners to assess individual- and organizational-level effectiveness challenges and provide recommendations of relevant learning solutions. Instructional design and development to craft great learning experiences using classroom learning, e-Learning, job aids and checklists, micro-learning, video, podcasting and more. Graphic, visual, and communication design to creatively convey ideas through text and images. LMS administration to provide IGS with a consistent, stable, well-built learning platform for learners (content curation and personalization) and managers (reporting) Learning innovation to meet the learning needs of IGS colleagues. Required Skills: You have excellent technical aptitude and an eye for details. You are tenacious and will work on a task over and over again in order to come up with an impeccable solution. You are skilled at making connections between pieces of information. You artfully juggle multiple tasks simultaneously. Experience: Bachelor\u2019s degree or relevant experience 2 years minimum experience, preferred in one of the following fields \u2013 education, training, marketing, or communications Proficient with instructional design tools such as Articulate Storyline, Camtasia, Adobe Captivate, Vyond, Articulate Rise, and the Microsoft suite']",Learning Producer
[],[u'Ryder'],"[u'3,002 reviews', u'Miami, FL 33138']","[u'Position Description\n', u'Under broad supervision, the ', u'Instructional Designer & e-Learning', u"" position is responsible for design, development, and maintenance of dynamic eLearning, instructor led, blended or performance support training solutions and tools that enhance the capabilities and productivity of Ryder's employees."", u'\n', u'Requirements\n', u""Bachelor's degree in business, education, instructional design technology, education technology, related area or minimum 8 years equivalent work experience in designing and developing e learning, instructor led, blended or performance support training materials and/or solutions"", u""\nMaster's degree in related field preferred"", u'\nFive (5) years or more experience assessing, designing, developing, and implementing learning solutions, as well as designing, developing, and producing e-learning training materials/solutions, planning, designing and developing an integrated curriculum (e.g., Corporate University, Trainee Programs).', u'\nFive (5) years or more experience in an education or business environment', u'\nStrong knowledge of adult learning principles and instructional design methodologies', u'\nExperience in using a Learning Management System (LMS) or Learning Content Management System (LCMS)', u'\nProven experience and ability to design, develop and facilitate effective needs analysis processes and provide training recommendations and estimates', u'\nAbility to build strong customer relationships', u'\nDemonstrates customer service skills', u'\nDemonstrates written communication skills', u'\nDevelops and delivers effective presentations', u'\nEffective interpersonal skills', u'\nAbility to be comfortable and effective with issues that lack clarity, structure or certainty', u'\nAbility to guide, engage, and impart knowledge to others', u'\nAbility to prioritize, structure and schedule tasks to maximize effort and meet deadlines', u'\nMaintains composure under pressure', u'\nAbility to effectively facilitate meetings, work sessions, and training', u'\nAbility to work within tight time-frames and meet strict deadlines', u'\nDemonstrates time management and priority setting skills', u'\nProject management skills', u'\nDemonstrates a high commitment to quality', u'\nKnowledge of at least one authoring/development tool such as Captivate, Storyline, etc. is required (Advanced level)', u'\nKnowledge of how to work closely with clients and subject matter experts to develop training strategies and solutions (Advanced level)', u'\nKnowledge of how to analyze information and identify needs and training/non-training (Advanced level)', u'\nKnowledge of Microsoft Office: Word, PowerPoint, Access, and Excel. (Intermediate level)', u'\n', u'Responsibilities\n', u'Creates learning content and testing to support major training and assessment initiatives, and set up report results into the LMS, as appropriate. Performs needs analysis and curriculum reviews on a regular basis', u'\nConsults with subject matter experts, business owners to develop instructionally sound objectives, content, and implementation and evaluation learning strategies to deliver customized learning solutions. Organizes projects appropriately to accomplish deliverables while adhering to scope and timeline. Collaborate in the development and implementation of best practices in the use of instructional technologies, tools, and processes', u'\nDesigns and develops learning project proposals / statement of work that also include program implementation and evaluation approaches', u'\nEnsures instructional design solutions are appropriately matched to objectives and desired outcomes. Commitment to identifying and communicating creative and innovative ideas in ways that gain consensus and build partnership', u'\nStays abreast on emerging trends in learning methods. Ensures training solutions incorporate best practices in adult learning', u'\nCollaborates with other team members on projects and initiatives', u'\nPerforms other duties as assigned', u'\nRyder is proud to be an Equal Opportunity Employer and Drug Free workplace. All qualified applicants will receive consideration for employment without regard to race, religion, color, national origin, sex, sexual orientation, gender identity, age, status as a protected veteran, among other things, or status as a qualified individual with disability.']",Instructional Designer & e-Learning
[],"[u'Amazon.com Services, Inc.']","[u'33,620 reviews', u'New Jersey']","[u'BA or BS degree with a strong academic record. An advanced degree in a relevant field is a plus.', u'5 years of work experience with solid career progression in designing, developing, and/or delivering classroom training in the workplace.', u'Strong knowledge of instructional theories: adult learning, on the job learning, knowledge management theories, principles in both virtual and classroom instruction.', u'Aptitude for learning and using technology for both training design and data analysis.', u'Practical experience in learning and business needs consulting.', u'Strong knowledge of and experience with performance and talent management.', u'Program management and administration skills: organization, managing details, keeping multiple tasks/projects on track, using time well, and doing whatever it takes to deliver reliable results.', u'Superior communication and influence skills are a must with the ability to communicate effectively and credibly both verbally and in writing with audiences at all management levels.', u'Innovative and proactive problem-solving skills with the ability to exercise integrity and sound judgment in complex and ambiguous situations.', u'\n', u'\n', u'As a Learning & Development Specialist and part of the North American Learning team, you will play a vital role in advancing Amazon\u2019s unique culture and enabling the success of new leaders in a high-growth, fast-paced organization. Our team provides world-class onboarding, learning and development programs for North American Operations which is comprised of Fulfillment, Transportation, and Supply Chain. We are continually innovating to make the basics quick and easy so we can turn our creative minds towards the more complex and interesting opportunities, which we have in abundance. We are customer-obsessed and innovative in our efforts to increase leadership capability. This means we build our own highly customized and targeted solutions that directly serve the business of our client group. If you are a go-getter with education and experience in L&D, then you should seriously consider growing your career with us.', u'\n', u'\nThis position requires up to 30% travel.', u'\n', u'\nJob Responsibilities', u'\n', u'Facilitate training programs using skillful application of adult learning theory to ensure learning outcomes are achieved. Draw upon a wide variety of techniques to ensure engagement, knowledge transfer, skill development as well as efficient and fun learning.', u'Build partnerships to support our business through learning, performance and talent management. Dive in to quickly learn about learner\u2019s goals and challenges, their work environment, how they walk (fast) and how they talk (straightforward).', u'Work as part of a team to design and deploy appropriate learning and performance solutions for leaders in the Operations organization. Use rapid design and distribution methods (virtual, classroom, blended and multi-media) that best suit audience needs and which tangibly and positively impact performance. Adapt materials created for the classroom to e-learning, mobile, and social tools.', u'Manage collection of, interpret and analyze business data to report conclusions and make recommendations based on findings. Produce written reports to communicate and gain support for solutions, measurement and evaluation plans.', u'Select, design and deploy appropriate mechanisms to measure learning impact.', u'Participate in or lead learning project teams. Build positive, collaborative and action oriented partnerships among SMEs, peers, and stakeholders to scale durable learning and performance solutions across North America.', u'Build deployment processes which scale as well as minimize development and deployment time for new learning or communication and which enable learners and their leaders to own development.', u'\n', u'\n', u'Formal training or education in Adult Learning, Human Performance Technology, Instructional Design, Training Delivery, and Training Evaluation is highly desirable.', u'Professional certifications.', u'Supervisory and Operations experience is a plus.', u'An advanced degree in a relevant field such as human resources, adult education, or organizational development.', u'\nAmazon is an Equal Opportunity-Affirmative Action Employer- Female/Minority/Disability/Veteran']",Learning & Talent Development Regional Specialist
