salary,company,place,description,title
[],[u'Sasol'],"[u'567 reviews', u'Lake Charles, LA']","[u'Sasol is an international integrated chemicals and energy company that leverages technologies and the expertise of more than 30,000 people working in more than 30 countries. We develop and commercialize technologies, and build and operate world-scale facilities to produce a range of high-value product streams, including liquid fuels, chemicals and low-carbon electricity.', u'\n', u'In North America, Sasol is building a world-scale petrochemical complex and already has operations in Arizona, Louisiana, Pennsylvania and Texas. Collectively, these sites employ a workforce of approximately 1,500 people and manufacture the primary ingredients in detergents, personal care products, waxes and specialty products used as abrasives, catalysts, thickeners, ceramics and more.', u'\n', u'Based in Johannesburg, South Africa, Sasol is listed on the New York and Johannesburg stock exchanges.', u'\n', u'Due to our tremendous growth we have an opening for a ', u'Learning Consultant ', u'to work at our Lake Charles Chemical Complex in Lake Charles, Louisiana.', u'\n', u'Sasol offers a comprehensive total rewards package with market-related compensation and benefits that are consistent across our sites in the USA. The total rewards package is competitive within our industry and is designed to attract and retain our most valuable assets - our employees. Come be a part of our Growing Team!!!', u'\n ', u'Position Responsibilities ', u':\n', u'Facilitate training per the Sasol North America (SNA) Training Plan\n', u'Identify and analyze training needs of SNA sites, workgroups, and individuals\n', u'Follow internal processes for coordination of training events\n', u'Design and develop training materials for instructor-led and online programs to include presentations, instructor and participant guides, job aids, examinations, skills demonstrations and computer based trainings (CBT)\n', u'Possess and leverage areas of specialization pertaining to the chemical industry and be able to collaborate effectively with subject matter experts (SME) to meet development needs\n', u'Serve as Learning Management System (LMS) Administrator, creating, assigning and manage employee curricula\n', u'Provide exceptional learning solutions and customer service to all SNA employees\n', u'Demonstrate commitment to excellence and team collaboration\n', u'Align with mandated Business Unit training plans\n', u'Serve as Help Desk support for the Learning Management System (LMS) and other software applications\n', u'Create and distribute reports utilizing LMS and Microsoft Excel\n', u'Other projects as assigned by the Learning Specialist', u'\n', u'Experience/Education Requirements ', u':\n', u'Relevant Bachelor\u2019s Degree in Business, Science or related field\n', u'Minimum 2 years of relevant experience in Training Development, Delivery and/or Instructional Design using Adult Learning Principles\n', u'Master\u2019s degree preferred\n', u'Excellent written and verbal communication skills to include presentation and public speaking skills\n', u'Excellent organizational and time management skills and attention to detail\n', u'Petrochemical industry experience preferred\n', u'LMS and/or database experience preferred\n', u'SuccessFactors experience a plus\n', u'Knowledge of regulatory compliance training (OSHA, Environmental, DOT, etc.) preferred\n', u'Advanced to Expert skills in Microsoft Office; specifically Microsoft Word & Excel\n', u'Proficiency using design and/or e-learning authoring tools. Articulate Storyline, Adobe InDesign preferred', u'\n', u'\n', u'Sasol (USA) Corporation is an Equal Opportunity Employer and gives consideration for employment to qualified applicants without regard to race, color, religion, creed, age, sex, sexual orientation, gender identity, pregnancy, national origin, disability or protected veteran status, as well as any other characteristic protected by applicable law, regulation or local ordinance. For more information about your rights under the law, see ', u'http://www.eeoc.gov/employers/upload/poster_screen_reader_optimized.pdf', u'\n', u'Sasol treats work-authorized job applicants equally in recruiting and hiring without regard to their citizenship status or national origin unless required by law, regulation, executive order, government contract, or determination by the Attorney General. Please note Sasol will not sponsor, obtain, and/or petition for temporary visa status (for example, E, F-1, H-1, H-2, L, B, J, or TN) for candidates for this position and/or personnel hired for this position.', u'\n', u'We are not accepting unsolicited resumes from 3rd party recruitment agencies, therefore we will not a pay a fee for resumes submitted.']",Learning Consultant
salary,company,place,description,title
[],[u'Group Voyagers'],"[u'12 reviews', u'Littleton, CO']","[u'ROLE: E-Learning Curriculum Designer', u'\n', u'DEPARTMENT: Human Resources', u'\n', u'REPORTS TO: Human Resources Director', u'\n', u'STATUS: Exempt', u'\n', u'JOB GRADE: EX 30', u'\n', u'WORKERS COMP CODE: 8810', u'\n', u'THE COMPANY', u'\n', u'At Globus family of brands, guests, partners, and associates are valued members of our family. Together we are in pursuit of our mission and vision and guided by our core values.', u'\n', u'Our Mission: We create happy guests.', u'\n', u'Our Vision: GFOB is family. We are genuine, loyal, and trusted. We are passionate about making guests happy and partners successful. We are open and welcoming. We make hard things easier. We are guided by our values. We do what\u2019s right. We care. It\u2019s what families do.', u'\n', u'Our Values:', u'\n', u' Passion- We are passionate about the Globus family of brands, our values, and making guests happy.', u'\n', u' Accountability-We can be counted on to do our best, follow through, learn from mistakes, and deliver results.', u'\n', u' Courage-We face challenges, surface issues, share our ideas, and do what\u2019s right.', u'\n', u' Collaboration-We work together, support each other, and involve others in decision making.', u'\n', u' Integrity-We are straightforward, honest, and open with our guests, partners, and each other.', u'\n', u' Service- We are proactive, anticipate the needs of others, and are always ready to listen.', u'\n', u'THE DEPARTMENT', u'\n', u'The Human Resources team strives to create a work environment where associates are enthusiastic about their jobs. HR is responsible for the implementation and execution of human resource functions and programs including compensation, performance management, succession planning, employee relations, benefit administration, employment regulations and compliance, recruiting, analysis and delivery of benefits, reception, and facilities maintenance.', u'\n', u'THE POSITION\n', u'Reviewing LMS technology, making recommendations for LMS and Implementing LMS', u'\n', u'Designing, building, and maintaining web-based, multi-media eLearning modules using authoring tools', u'\n', u'Publishing and delivering eLearning modules', u'\n', u'Integrating emerging instructional design methods and technologies into eLearning modules', u'\n', u'Working with subject matter experts/stakeholders and other personnel in identifying and developing course content and learning needs within required timeframes.', u'\n', u'Performing needs assessment and analysis to determine organizational needs and recommends training methods accordingly.', u'\n', u'Designing and implementing evaluation strategies for measuring the success of training programs.', u'\n', u'Tracking employee performance and measures training outcomes.', u'\n', u'Maintaining communication with training stakeholders and building collaborative partnerships with internal customers.', u'\n', u'Responding to and resolving LMS end user issues related to training.', u'\n', u'Maintaining records related to training.', u'\n', u'Developing and delivering instructor led (live on line) courses as needed including workshops related to LMS capabilities for a variety of audiences.', u'\n', u'Conducting periodic review of existing courses to ensure content is relevant and accurate.', u'\n', u'Managing eLearning development projects', u'\n', u'Creating multimedia products using a variety of software programs, primarily in Microsoft PowerPoint, Microsoft Word, Adobe Creative Cloud', u'\n', u'Applying interaction design and interactive learning principles to instructional solutions for adult learners', u'\n', u'Selecting, modifying, and integrating existing instructional materials that employ multimedia and emerging technologies', u'\n', u'EDUCATION', u'\n', u'Bachelor\u2019s degree or equivalent experience required, with a focus in multimedia design, graphic design, instructional design, or related field in learning and development', u'\n', u'Masters in Instructional Design or 3-5 years\u2019 meaningful experience in eLearning Instructional Design (ID) preferred', u'\n', u'ATD E-learning Instructional Design Certificate preferred\n', u'EXPERIENCE REQUIRED', u'\n', u'Minimum 3 years\u2019 experience in the successful design and creation of corporate eLearning programs\n', u'Strong analytical and problem-solving skills', u'\n', u'Strong time management skills and ability to meet deadlines, acknowledging urgency when necessary', u'\n', u'Detail-oriented and excellent organizational skills', u'\n', u'Working knowledge of web technologies (HTML5, JavaScript, CSS) and E-learning development software and other authoring tools', u'\n', u'Understanding of adult learning theories and evaluation methods', u'\n', u'Working knowledge of learning and development trends and compliance requirements', u'\n', u'Ability to craft and maintain multiple courses at a time', u'\n', u'TECHNICAL EXPERIENCE REQUIRED:', u'\n', u'Microsoft Office Suite \u2013 Word, Excel, PowerPoint, Publisher, and Outlook', u'\n', u'Experience using an LMS is required', u'\n', u'High degree of proficiency with Adobe Creative Suite is required \u2013 Photoshop, Illustrator, Premier', u'\n', u'Knowledge of E Learning Software and ability to recommend and implement', u'\n', u'MANAGEMENT KEY COMPETENCIES REQUIRED', u'\n', u' Strategic Ability', u'\n', u'o Keeps abreast of important trends that impact the industry, business or organization (technological, competitive, social, economic, etc.)', u'\n', u'o Considers a broad range of internal and external priorities when making decisions or solving problems', u'\n', u'o Comprehends and utilizes knowledge of competitors\u2019 business when making strategic decisions', u'\n', u' Business Acumen', u'\n', u'o Exhibits awareness of business issues, processes and outcomes and their impact on the organization\u2019s and department\u2019s direction and goals', u'\n', u'o Remains informed about the industry and how changes might impact the organization', u'\n', u'o Understands the key functions of various departments and how they inter-relate; Utilizes appropriate channels and processes', u'\n', u'\xa7 Researches, investigates, analyzes and draws conclusions from facts and trends', u'\n', u' Management & Leadership', u'\n', u'o Provides clear directions and priorities; delegates tasks appropriately', u'\n', u'o Ensures adequate resources and support are available to achieve goals', u'\n', u'o Routinely provides feedback on performance and uses effective coaching and counseling techniques', u'\n', u'o Cultivates the strengths of associates, coaches towards achievement, and sets plans for improvement', u'\n', u'o Recognizes ability, mentors and provides developmental opportunities to associates for career growth', u'\n', u'o Creates an open, positive and productive work environment where associates have the opportunity to succeed', u'\n', u'o Understands how to separate and combine tasks into efficient and effective workflow', u'\n', u' Fiscal Responsibility', u'\n', u'o Develops annual budget for area of responsibility', u'\n', u'o Monitors performance to budget & participates in quarterly re-forecasting', u'\n', u'o Controls costs (i.e. schedule adherence for o/t; absorptions; personal travel expenses; supply ordering)', u'\n', u'o Is timely in all reporting required (expense reports, accounts payable, monthly variance reporting)', u'\n', u'KEY COMPETENCIES REQUIRED', u'\n', u'The preferred candidate possesses the following competencies:', u'\n', u' Service: We are proactive, anticipate the needs of others and are always ready to listen.', u'\n', u'Desires to help others and to meet their needs. This includes internal and external partners, offices, guests, and vendors', u'\n', u'Seeks win-win situations and presents options, especially in resolving conflicts', u'\n', u'Provides timely and helpful information to others', u'\n', u'Takes action on behalf of others to simplify their life/work/experience', u'\n', u'Responsive and attentive to the needs of others', u'\n', u' Passion: We are passionate about the Globus family of brands, our values, and making guests happy.', u'\n', u'o Strives to retain goodwill even when modifying or denying requests', u'\n', u'o Positive energy and enthusiastic when dealing with others', u'\n', u'o Takes pride in doing the right things', u'\n', u'o Treats guests, colleagues, and partners with respect', u'\n', u' Teamwork & Collaboration: We work together, support each other, and involve others in decision making.', u'\n', u'Builds and maintains effective working relationships with co-workers, partners, guests, and vendors to improve business processes and outcomes.', u'\n', u'Treats others with respect', u'\n', u'Contributes to achievement of team and departmental goals', u'\n', u'Provides back up and support to others as needed', u'\n', u'Fosters collaboration among team members, departments, companies, partners, etc.', u'\n', u'Relates to others in an open and accepting manner', u'\n', u'Recognizes a wide range of communications styles and personality types and responds appropriately', u'\n', u'Cultivates and maintains professional relationships', u'\n', u'Collaborates with internal partners', u'\n', u'Shares pertinent information to the benefit of others', u'\n', u' Results and Accountability: We can be counted on to do our best, follow through, learn from mistakes and deliver results.', u'\n', u'Works with the team and management to achieve individual, department, and corporate goals', u'\n', u'Meets critical deadlines within time frame outlined', u'\n', u'Demonstrates willingness, openness, persistence, and initiative to achieve desired results', u'\n', u'Probes to get to the heart of the problem and takes action to achieve results', u'\n', u'Focuses priorities and manages time effectively', u'\n', u'Takes ownership of work and assigned processes and projects', u'\n', u' Ethics and Integrity: We are straightforward, honest, and open with our guests, partners, and each other.', u'\n', u'o Conducts business in a way that instills trust, confidence and respect', u'\n', u'o Utilizes fair process without bias', u'\n', u'o Acts with discretion and good judgment while maintaining confidentiality', u'\n', u'o Exercises the highest standard of ethics in all decisions that impact guests, vendors, suppliers, and the organization', u'\n', u'o Takes ownership of work and assigned processes/projects', u'\n', u' Agility, Adaptability, and Flexibility through Courage: We face challenges, surface issues, share our ideas, and do what is right.', u'\n', u'o Demonstrates resilience in the face of constraints, frustrations, or adversity', u'\n', u'o Displays willingness and flexibility in handling multiple demands, changing priorities, and ongoing organizational needs', u'\n', u'o Quickly and effectively evaluates and appropriately adjusts to a change in direction or situation', u'\n', u'o Accepts change as a necessary and normal part of organizational growth', u'\n', u'o Open to adopting new approaches and behaviors', u'\n', u'o Handles day to day work challenges confidently', u'\n', u' Effective Communication', u'\n', u'o Professionally conveys information and ideas both orally and in writing.', u'\n', u'o Maintains positive and professional verbal and nonverbal communication with all', u'\n', u'o Shares information appropriately and is receptive to feedback and expression of ideas', u'\n', u'o Perceives the needs of various audiences and can adjust communications appropriately', u'\n', u'o Listens and responds appropriately to others.', u'\n', u'\n', u'EOE', u'\n', u'While performing this job, it will require: Eight (8) hours or more a day of sitting; walking; standing; bending; answering the telephone; entering data into the computer; retrieving data from the computer or analyzing data from reports.']",E-Learning Curriculum Designer
[],[u'CoreAxis'],[u'United States'],"[u'Contract to permanent', u'\nThe Learning and Development Coordinator is responsible for the planning, coordination, implementation and evaluation of innovative and contemporary learning and development programs that supports strategies to build a sustainable, resilient, and adaptable workforce.', u'\n', u'\n', u'Key Responsibilities:', u'\n', u'\n', u'Review and revitalize all existing learning and development activities considering new modes of delivery for remote workers, residential, professional, administrative staff and volunteers.', u'\nCo-ordinate and maintain the organizations orientation program for new staff and volunteers that includes service and position specific checklists, self directed learning packages, buddying and mentoring, corporate orientation and customer care programs.', u'\nCoordinate and maintain the organizational learning and development calendars and associated awareness months, considering mechanisms to promote the various activities and maximize participation from staff and volunteers across the company\u2019s geographic footprint.', u'\nOversee the planning, delivery and evaluation of mandatory training programs to ensure skilled staff and volunteers and compliancy with quality standards and audit requirements. This includes the preparation of reports on staff attendance and follow up actions.', u'\nBuild a register and maintain relationships with a range of reputable training providers in the areas of leadership, management, clinical, care and other key organizational learning and development priorities.', u'\nCoordinate requests to attend external courses and conferences which involves follow up on approvals, registrations and the associated travel and accommodation requirements.', u'\nOversee the coordination of internal learning and development activities, including: workshops, toolbox talks and staff meeting training sessions which may include the sourcing of contemporary trainers, guest speakers, specialist providers, educational consultants as requested by Service Managers. This may include assisting with organizing venues, RSVP\u2019s, catering, training materials and equipment.', u'\nCoordinate and manage traineeships in conjunction with managers, trainees and service providers, including monitoring key deadlines, reimbursements and funding incentives, coordinating supervision and training activities, sourcing government funding and initiatives and actively feeding into the curriculum development where possible.', u'\nEnsure learning and development records and statistics are maintained and reported to effectively monitor, manage and plan organizational learning and development activities.', u'\nEvaluate internally and externally facilitated learning and development activities, workshops and conferences and report on the return on investment in terms of costs, learning\u2019s gained, strategies to reinforce learning and share knowledge with the organization as appropriate.', u'\nIdentify opportunities for funding which can be utilized to provide enhanced programs and opportunities for professional development and expand staff qualifications, knowledge and skill base including assisting with application preparation and submission.', u'\nAssist Managers with design and delivery of training and e-learning packages providing templates for lesson plans, presentation formats, facilitator guide formats, participant guides and evaluation documentation.', u'\nActively participate in special projects, initiatives or programs as required.']",Learning Coordinator
